{
    "$schema": "http://json-schema.org/schema#",
    "id":"https://raw.githubusercontent.com/pca006132/CommandReference/master/schema.json",
    "type": "object",
    "title": "Root tag",
    "additionalProperties": false,
    "properties": {
        "common-words": {
            "type": "array",
            "items": {
                "type": "array",
                "items": [
                    {
                        "type": "string",
                        "title": "词",
                        "description": "那常用词以及其缩写"
                    },
                    {
                        "type": "string",
                        "title": "描述"
                    }
                ]
            }
        },
        "threads": {
            "type": "object",
            "additionalProperties": false,
            "patternProperties": {
                "https?:\\/\\/(www\\.)?[-a-zA-Z0-9@:%._\\+~#=]{2,256}\\.[a-z]{2,6}\\b([-a-zA-Z0-9@:%_\\+.~#?&//=]*)": {
                    "type": "object",
                    "additionalProperties": false,
                    "properties": {
                        "title": {
                            "type": "string",
                            "title": "帖子标题"
                        },
                        "last-update": {
                            "type": "string",
                            "format": "^\\d{4}-\\d{2}-\\d{2}$"
                        },
                        "tags": {
                            "type": "array",
                            "items": {
                                "type": "string",
                                "enum": [
                                    "基础",
                                    "进阶",
                                    "计算",
                                    "几何",
                                    "算法",
                                    "特技",
                                    "NBT",
                                    "游戏机制",
                                    "黑科技",
                                    "人生经验",
                                    "游戏系统",
                                    "命令介绍",
                                    "原版模组",
                                    "地图作品",
                                    "概念验证",
                                    "OOC生成",
                                    "自定义生成器",
                                    "其他生成器/资源",
                                    "实例",
                                    "过时",
                                    "即将过时",
                                    "英语"
                                ]
                            },
                            "minItems": 1,
                            "maxItems": 5
                        },
                        "category": {
                            "type": "string",
                            "enum": [
                                "有趣问答",
                                "算法逻辑",
                                "系统制作技巧",
                                "NBT介绍",
                                "作品例子",
                                "游戏机制",
                                "教程索引",
                                "命令/格式教程",
                                "常用网站",
                                "生成器/资源",
                                "其他"
                            ]
                        },
                        "version-min": {
                            "type": "integer",
                            "minimum": 8,
                            "maximum": 13
                        },
                        "version-max": {
                            "type": "integer",
                            "minimum": 8,
                            "maximum": 13
                        },
                        "recommended": {
                            "type": "integer",
                            "minimum": 0,
                            "maximum": 2
                        }
                    },
                    "required": [
                        "title", "last-update", "tags", "category", "version-min", "version-max", "recommended"
                    ]
                }
            }
        },
        "tags": {
            "type": "array",
            "items": {
                "type": "string"
            }
        },
        "version": {
            "type": "object",
            "properties": {
                "min": {
                    "type": "integer"
                },
                "max": {
                    "type": "integer"
                }
            },
            "required": [
                "min", "max"
            ],
            "additionalProperties": false
        }
    },
    "required": [
        "common-words", "threads", "tags", "version"
    ]
}